{
  "schema": "protected-relation-fixture.v0",
  "fixture_id": "prf-004",
  "class": "projection-equivalent-relation-non-equivalent",
  "protected_relation": {
    "kind": "multiplicity_sensitive_relation",
    "identity_policy": "anchored",
    "relation_type_policy": "typed-exact",
    "multiplicity_policy": "multiset-exact",
    "direction_policy": "directed-exact",
    "scope": ["A", "B"],
    "universe": ["A", "B"],
    "equivalence_policy": "exact",
    "policy_version": "v0"
  },
  "before": {
    "links": [
      { "source": "A", "target": "B", "relation": "supports", "link_id": "L1" },
      { "source": "A", "target": "B", "relation": "supports", "link_id": "L2" }
    ]
  },
  "after": {
    "links": [
      { "source": "A", "target": "B", "relation": "supports", "link_id": "L1" }
    ]
  },
  "projections": [
    {
      "id": "set-like-neighbor-membership",
      "before": ["B"],
      "after": ["B"],
      "preserved": true
    },
    {
      "id": "edge-exists-A-B",
      "before": true,
      "after": true,
      "preserved": true
    }
  ],
  "expected": {
    "semantic_outcome": "VIOLATED",
    "projection_preserved": true,
    "protected_relation_preserved": false,
    "reason_class": "multiplicity-collapse",
    "fail_closed_required": true
  },
  "metadata": {
    "tags": ["multiplicity", "multiset", "typed-edge"],
    "minimality_status": "seed",
    "rationale": "Set-like observations still pass, but multiplicity-sensitive protected semantics are no longer preserved."
  }
}
